{
  "schema": "cloudig/content-time/1.0.0",
  "node_id": "01993520-0000-7000-8000-000000000201",
  "kind": "timeline",
  "name": "星河纪元",
  "author": "示例作者",
  "version": "1.0",
  "created_at": "2026-09-11T09:00:00Z",
  "edited_at": "2026-09-11T09:00:00Z",
  "contains": [
    {
      "node": "01993520-0000-7000-8000-000000000202"
    }
  ]
}
