{
  "schema": "cloudig/content-time/1.0.0",
  "node_id": "01993520-0000-7000-8000-000000000901",
  "kind": "single",
  "name": "现代社会",
  "edited_at": "2026-09-11T09:00:00Z",
  "terran_mappings": [
    {
      "range": {
        "start": {
          "kind": "decade",
          "era": "AD",
          "index": 194
        },
        "end": {
          "kind": "now",
          "anchor": {
            "date": "2026-09-11",
            "offset": "Z"
          }
        }
      },
      "edited_at": "2026-09-11T09:00:00Z"
    }
  ]
}
