{
  "schema": "cloudig/content-time/1.0.0",
  "node_id": "01993520-0000-7000-8000-000000000202",
  "kind": "single",
  "name": "初航",
  "edited_at": "2026-09-11T09:00:00Z",
  "terran_mappings": [
    {
      "range": {
        "start": {
          "kind": "calendar",
          "era": "AD",
          "year": 2026,
          "month": 9
        }
      },
      "edited_at": "2026-09-11T09:00:00Z"
    }
  ]
}
